{
  "schemaVersion": 1,
  "projects": {},
  "providers": {
    "codex": {
      "roots": [
        "~/.codex/skills"
      ],
      "pluginRoots": [
        "~/.codex/plugins"
      ],
      "systemRoots": [
        "~/.codex/system/skills"
      ],
      "historyRoots": [
        "~/.codex/sessions",
        "~/.codex/archived_sessions"
      ]
    },
    "claude": {
      "roots": [
        "~/.claude/skills"
      ],
      "pluginRoots": [
        "~/.claude/plugins"
      ],
      "systemRoots": [
        "~/.claude/system/skills"
      ],
      "historyRoots": [
        "~/.claude/projects",
        "~/.claude/telemetry"
      ]
    },
    "hermes": {
      "roots": [
        "~/.hermes/skills"
      ],
      "pluginRoots": [
        "~/.hermes/plugins"
      ],
      "systemRoots": [
        "~/.hermes/system/skills"
      ],
      "historyRoots": [
        "~/.hermes/sessions"
      ]
    },
    "opencode": {
      "roots": [],
      "pluginRoots": [],
      "systemRoots": [],
      "historyRoots": []
    }
  },
  "policy": {
    "detailRetentionDays": 180,
    "fingerprintFamilies": {
      "tools": [
        "read",
        "search",
        "edit",
        "test",
        "git",
        "shell",
        "delegate"
      ],
      "executables": [
        "node",
        "npm",
        "pnpm",
        "yarn",
        "bun",
        "git",
        "rg",
        "grep",
        "sed",
        "awk",
        "jq",
        "bash",
        "python3"
      ],
      "results": [
        "success",
        "failure",
        "error",
        "timeout",
        "partial",
        "unknown"
      ]
    },
    "evalAdapter": {
      "enabled": false,
      "command": "agent-skill-eval",
      "version": "v1"
    }
  }
}
